{
  "$schema": "http://json-schema.org/draft-07/schema#",
  "$id": "agentic-testcase-suite",
  "title": "Agentic Test Suite",
  "description": "Agent-delegation test suite for agentic CLI exec. Optimized for minimal token consumption. Compatible with ~/.claude/scripts/run-testcases.sh.",
  "type": "object",
  "required": ["suite", "cases"],
  "additionalProperties": false,
  "properties": {
    "suite": {
      "type": "string",
      "description": "Identifier for the test suite (kebab-case). Used in session seed derivation.",
      "pattern": "^[a-z0-9][a-z0-9-]*[a-z0-9]$"
    },
    "runner": {
      "type": "string",
      "description": "Command prefix used to invoke exec steps. Appended with: exec \"<cmd>\" --agentic --format json --session-seed <seed> --project <project> --mode <mode>. Supports {suite_dir} placeholder (resolved to the directory containing this file). Example: \"dotnet run --project {suite_dir}/../src/unifocl/unifocl.csproj --disable-build-servers -v minimal --\""
    },
    "project": {
      "type": "string",
      "description": "Path to the target project. Overridden by --project CLI arg. Relative to suite file directory."
    },
    "mode": {
      "type": "string",
      "enum": ["project", "hierarchy", "inspector"],
      "default": "project",
      "description": "Default context mode for all steps. Can be overridden per-step."
    },
    "cases": {
      "type": "array",
      "minItems": 1,
      "items": { "$ref": "#/definitions/TestCase" }
    }
  },
  "definitions": {
    "TestCase": {
      "type": "object",
      "required": ["id", "steps"],
      "additionalProperties": false,
      "properties": {
        "id": {
          "type": "string",
          "description": "Unique case identifier (kebab-case). Used as part of session seed.",
          "pattern": "^[a-z0-9][a-z0-9-]*$"
        },
        "predict": {
          "type": "string",
          "enum": ["pass", "fail"],
          "default": "pass",
          "description": "'pass': all step assertions must hold. 'fail': at least one step is expected to fail (regression guard). Unexpected outcomes are runner failures."
        },
        "steps": {
          "type": "array",
          "minItems": 1,
          "description": "Ordered command steps. State is shared across steps via a per-case session seed. Include any setup (e.g. /init) as early steps.",
          "items": { "$ref": "#/definitions/Step" }
        }
      }
    },
    "Step": {
      "type": "object",
      "required": ["cmd"],
      "additionalProperties": false,
      "properties": {
        "cmd": {
          "type": "string",
          "description": "Unifocl command text, passed verbatim to `unifocl exec`. Example: \"/dump hierarchy\" or \"/mutate [{\\\"op\\\":\\\"create\\\"}]\"."
        },
        "assert": {
          "$ref": "#/definitions/AssertMap",
          "description": "Assertions against the AgenticResponseEnvelope JSON. If omitted, defaults to { \".status\": \"ok\", \".meta.exitCode\": 0 }."
        },
        "mode": {
          "type": "string",
          "enum": ["project", "hierarchy", "inspector"],
          "description": "Override context mode for this step only."
        }
      }
    },
    "AssertMap": {
      "type": "object",
      "description": "Keys are jq path expressions (e.g. \".status\", \".data.allOk\", \".errors | length\"). Values are expected scalars or operator objects.",
      "additionalProperties": {
        "oneOf": [
          { "type": ["string", "number", "boolean", "null"] },
          { "$ref": "#/definitions/AssertOperator" }
        ]
      }
    },
    "AssertOperator": {
      "type": "object",
      "description": "Special assertion operators for non-equality checks.",
      "additionalProperties": false,
      "properties": {
        "$exists": {
          "type": "boolean",
          "description": "true: path must not be null/missing. false: path must be null/missing."
        },
        "$ne": {
          "description": "Path value must not equal this."
        },
        "$gt": {
          "type": "number",
          "description": "Path value must be greater than this number."
        },
        "$gte": {
          "type": "number",
          "description": "Path value must be >= this number."
        },
        "$contains": {
          "type": "string",
          "description": "Path value (string or array) must contain this substring or element."
        }
      }
    }
  }
}
